{
  "$schema": "http://json-schema.org/draft-07/schema#",
  "title": "Qwen Code Configuration Schema",
  "type": "object",
  "properties": {
    "security": {
      "type": "object",
      "properties": {
        "auth": {
          "type": "object",
          "properties": {
            "selectedType": {
              "type": "string",
              "enum": [
                "qwen-oauth",
                "openai",
                "alibaba-cloud-coding-plan",
                "coding-plan-china",
                "coding-plan-global"
              ]
            }
          }
        },
        "folderTrust": {
          "type": "object",
          "properties": {
            "enabled": {
              "type": "boolean"
            }
          }
        }
      }
    },
    "output": {
      "type": "object",
      "properties": {
        "format": {
          "type": "string",
          "enum": ["json", "stream-json", "text"]
        },
        "includePartialMessages": {
          "type": "boolean"
        }
      },
      "required": ["format"]
    },
    "model": {
      "type": "object",
      "properties": {
        "name": {
          "type": "string"
        },
        "maxSessionTurns": {
          "type": "integer"
        },
        "generationConfig": {
          "type": "object"
        }
      }
    },
    "tools": {
      "type": "object",
      "properties": {
        "sandbox": {
          "oneOf": [
            { "type": "boolean" },
            { "type": "string" }
          ]
        },
        "approvalMode": {
          "type": "string",
          "enum": ["plan", "default", "auto-edit", "yolo", "bypassPermissions", "dontAsk"]
        },
        "enableInteractiveShell": {
          "type": "boolean"
        },
        "useRipgrep": {
          "type": "boolean"
        },
        "useBuiltinRipgrep": {
          "type": "boolean"
        },
        "truncateToolOutputThreshold": {
          "type": "number"
        },
        "truncateToolOutputLines": {
          "type": "number"
        }
      }
    },
    "permissions": {
      "type": "object",
      "properties": {
        "defaultMode": {
          "type": "string",
          "enum": ["plan", "default", "auto-edit", "yolo", "bypassPermissions", "dontAsk"]
        },
        "allow": {
          "type": "array",
          "items": {
            "type": "string"
          }
        },
        "ask": {
          "type": "array",
          "items": {
            "type": "string"
          }
        },
        "deny": {
          "type": "array",
          "items": {
            "type": "string"
          }
        }
      }
    },
    "general": {
      "type": "object",
      "properties": {
        "preferredEditor": {
          "type": "string"
        },
        "vimMode": {
          "type": "boolean"
        },
        "enableAutoUpdate": {
          "type": "boolean"
        },
        "gitCoAuthor": {
          "type": "boolean"
        },
        "checkpointing": {
          "type": "object",
          "properties": {
            "enabled": {
              "type": "boolean"
            }
          }
        },
        "defaultFileEncoding": {
          "type": "string"
        }
      }
    },
    "context": {
      "type": "object",
      "properties": {
        "fileName": {
          "oneOf": [
            { "type": "string" },
            { "type": "array", "items": { "type": "string" } }
          ]
        },
        "includeDirectories": {
          "type": "array",
          "items": {
            "type": "string"
          }
        },
        "loadFromIncludeDirectories": {
          "type": "boolean"
        },
        "fileFiltering": {
          "type": "object",
          "properties": {
            "respectGitIgnore": {
              "type": "boolean"
            },
            "respectQwenIgnore": {
              "type": "boolean"
            },
            "enableRecursiveFileSearch": {
              "type": "boolean"
            },
            "enableFuzzySearch": {
              "type": "boolean"
            }
          }
        }
      }
    },
    "env": {
      "type": "object",
      "additionalProperties": {
        "type": "string"
      }
    },
    "modelProviders": {
      "type": "object",
      "additionalProperties": {
        "type": "array",
        "items": {
          "type": "object",
          "properties": {
            "id": {
              "type": "string"
            },
            "name": {
              "type": "string"
            },
            "baseUrl": {
              "type": "string"
            },
            "envKey": {
              "type": "string"
            },
            "description": {
              "type": "string"
            },
            "generationConfig": {
              "type": "object"
            }
          },
          "required": ["id", "envKey"]
        }
      }
    },
    "slashCommands": {
      "type": "object",
      "additionalProperties": true
    },
    "mcp": {
      "type": "object",
      "additionalProperties": true
    },
    "mcpServers": {
      "type": "object",
      "additionalProperties": true
    },
    "lsp": {
      "type": "object",
      "additionalProperties": true
    },
    "telemetry": {
      "type": "object",
      "additionalProperties": true
    },
    "advanced": {
      "type": "object",
      "additionalProperties": true
    }
  },
  "additionalProperties": true
}
